{
  "schema_version": "0.1",
  "summary_mode": "conversation-first",
  "title": "修复登录状态随机失效并限定为前端改动",
  "user_requests": [
    {
      "request": "修复登录状态随机失效",
      "constraints": [
        "只修改前端",
        "不增加第三方依赖"
      ],
      "source_refs": ["host-message:user-18", "host-message:user-23"]
    }
  ],
  "ai_actions": [
    {
      "action": "检查认证状态与 token 刷新流程",
      "result": "定位到并发 401 导致重复 refresh",
      "source_refs": ["host-message:assistant-19"]
    },
    {
      "action": "比较 mutex 与 queue 两种实现方式",
      "result": "最终采用 queue",
      "source_refs": ["host-message:assistant-21", "host-message:user-22"]
    },
    {
      "action": "重构 authStore 并实现 refresh queue",
      "tool_refs": ["tool:edit_file:471", "tool:test:475"]
    }
  ],
  "decisions": [
    {
      "statement": "采用 refresh queue，不引入第三方依赖",
      "made_by": "joint",
      "status": "accepted",
      "source_refs": ["host-message:user-22"]
    },
    {
      "statement": "多标签页同步本次不处理",
      "made_by": "user",
      "status": "deferred",
      "source_refs": ["host-message:user-27"]
    }
  ],
  "direction_changes": [],
  "outcomes": [
    "单页面内的并发 token 刷新流程已统一"
  ],
  "unresolved": [
    "跨标签页认证状态同步尚未覆盖"
  ],
  "tests": [
    {
      "name": "auth integration",
      "status": "passed"
    }
  ],
  "affected_areas": ["authStore", "token refresh"],
  "verification_notes": [],
  "source_session_ref": "host-session-789",
  "confidence": 0.94
}
